"PLAD","themes"
"北京市","财税金融, 餐饮美食, 房屋住宅, 环境与资源保护, 交通服务, 教育科研, 经济建设, 劳动就业, 旅游住宿, 农业农村, 企业服务, 社会保障, 生活安全, 生活服务, 文体娱乐, 消费购物, 信用服务, 医疗健康, 政府机构与社会团体, 宗教信仰"
"江苏省","安全生产, 出境入境, 工程建设, 行业准营, 环境资源, 交通旅游, 教育培训, 劳动就业, 纳税缴费, 其他, 三农服务, 设立变更, 社会保障, 涉外服务, 生活服务, 投资立项, 文物保护, 医疗卫生, 执业资格, 住房保障"
"河北省","安全监管, 财税金融, 城建住房, 道路交通, 地理空间, 机构团体, 教育科技, 社保就业, 食药安全, 卫生健康, 无, 信用服务, 资源环境"
"河南省","财税金融, 城建住房, 工业农业, 公共安全, 公共数据, 机构团体, 交通运输, 教育文化, 经济发展, 科技创新, 民生服务, 其他, 气象服务, 社保就业, 社会发展, 审计监督, 市场监督, 通信, 文化休闲, 医疗卫生, 资源环境, 自然资源"
"福建省","安全生产, 财税金融, 城乡建设, 地理空间, 法律服务, 工业农业, 公共安全, 公共服务, 海洋服务, 机构团体, 交通运输, 教育科技, 闽台和海外合作, 气象服务, 商贸流通, 社保就业, 社会救助, 生活服务, 生态环境, 市场监管, 统计服务, 卫生健康, 文化旅游, 信用服务, 医疗保障, 资源能源"
"辽宁省","安全监管, 地理, 交通运输, 教育, 就业, 科技, 农业, 企业登记监管, 气象, 社会保障, 生态, 统计, 卫生, 文化, 信用, 医疗, 资源"
